{
  "句列表": [
    {
      "句": "E01-S001",
      "起": "00:05.0",
      "止": "00:07.0",
      "文本": "今天必须说清楚。",
      "声线": "E01-V1",
      "相似度": 0.9,
      "置信度": 0.9,
      "合并依据": [
        "voiceprint"
      ],
      "待定": false,
      "疑似重叠": false,
      "重叠依据": [],
      "参与聚类": true
    }
  ],
  "类别": [
    {
      "声线": "E01-V1",
      "句数": 1,
      "聚类句数": 1,
      "代表句": [
        {
          "句": "E01-S001",
          "起": "00:05.0",
          "止": "00:07.0",
          "文本": "今天必须说清楚。"
        }
      ]
    }
  ],
  "类间相似度矩阵": [
    [
      1.0
    ]
  ],
  "矩阵声线顺序": [
    "E01-V1"
  ],
  "约束": {
    "参数": {},
    "冲突": [],
    "cannot-link": [],
    "must-link数": 0,
    "Grok覆盖句数": 0
  },
  "输入可用性": {
    "Grok词数": 0,
    "口型记录": false,
    "人数上限": null
  }
}
